Weapon Name,damage 1,damage 2,damage 3,damage 4,damage 5,fireRate 1,fireRate 2,fireRate 3,fireRate 4,fireRate 5,range 1,range 2,range 3,range 4,range 5,Unique 1,Unique 2,Unique 3,Unique 4,Unique 5,Unlock Cost,cost 1,cost 2,cost 3,cost 4,weaponFuelUseRate 1,weaponFuelUseRate 2,weaponFuelUseRate 3,weaponFuelUseRate 4,weaponFuelUseRate 5,,weaponDescription
Minigun,0.60,0.70,0.80,0.90,1.00,0.20,0.18,0.15,0.13,0.10,20.00,20.50,21.00,21.50,22.00,0.00,0.00,0.00,0.00,0.00,0,500,1500,2000,2500,0.00,0.00,0.00,0.00,0.00,,Fires a high rate of bullets but with low power.
Shotgun,1.00,1.75,2.50,3.25,4.00,0.80,0.70,0.60,0.50,0.40,20.00,20.00,20.00,20.00,20.00,0.00,0.00,0.00,0.00,0.00,3,1000,1500,2000,2500,0.00,0.00,0.00,0.00,0.00,,Fires a destructive volley of shots that stuns the enemy.
Plasma,1.50,1.88,2.25,2.63,3.00,1.00,0.83,0.65,0.48,0.30,20.00,21.25,22.50,23.75,25.00,2.00,2.00,3.00,3.00,4.00,5,1000,1500,2000,2500,0.00,0.00,0.00,0.00,0.00,,Fires a plama beam piercing through enemies.
Flamer,0.80,1.10,1.40,1.70,2.00,0.20,0.19,0.18,0.16,0.15,7.00,8.25,9.50,10.75,12.00,0.00,0.00,0.00,0.00,0.00,0,500,1500,2000,2500,20.00,17.50,15.00,12.50,10.00,,Burns enemies to a crisp with napalm.
Shocker,0.60,0.95,1.30,1.65,2.00,0.20,0.19,0.18,0.16,0.15,10.00,11.25,12.50,13.75,15.00,3.00,3.00,4.00,4.00,5.00,3,1000,1500,2000,2500,20.00,17.50,15.00,12.50,10.00,,Zaps enemies and chains to the nearest target.
Cryo,1.00,1.50,2.00,2.50,3.00,0.60,0.50,0.40,0.30,0.20,15.00,17.50,20.00,22.50,25.00,0.50,0.88,1.25,1.63,2.00,5,1000,1500,2000,2500,20.00,17.50,15.00,12.50,10.00,,Freezes enemies for a short time with cyro spikes.
,,,,,,,,,,,,,,,,,1,2,3,,,,,,,,,,,,,